{
  "manufacturer": "Rain Bird",
  "product_family": "1800 Series Spray Heads",
  "model": "1804",
  "status": "current",
  "application_type": "spray_head",
  "inlet_size_in": 0.5,
  "pressure_range_psi": {
    "min": 15,
    "max": 70
  },
  "compatibility_notes": "Designed for Rain Bird U-Series, HE-VAN, R-VAN, MPR, VAN, and XPCN plastic spray head nozzles.",
  "installation_constraints": "Bottom inlet only.",
  "source": {
    "url": "https://www.rainbird.com/media/13671",
    "document_title": "1800 Series Spray Heads Tech Spec",
    "revision_date": "11/21",
    "retrieved_on": "2026-08-23"
  },
  "notes": "4 inch pop-up height and 6 inch body height. Flow-by is 0 gpm at 8 psi or greater and 0.1 gpm otherwise. The spray body has no independent nozzle performance table; radius, flow, and precipitation depend on the installed nozzle."
}
